[
  {
    "conditionId": "cushing-syndrom-hyperkortisolismus",
    "summary": "Cushing-Syndrom und autonomer Hyperkortisolismus sind klinische Wahrscheinlichkeitsdiagnosen, die biochemisch bestätigt werden müssen. Die Leitlinien betonen gezielte Testung bei progredienten oder diskriminativen Zeichen und raten von breitem Screening bei nur unspezifischer Adipositas, Diabetes oder Hypertonie ab.",
    "whenToTest": [
      "Vor biochemischer Testung exogene Glukokortikoidexposition aktiv ausschließen.",
      "Testen bei multiplen/progredienten oder altersuntypischen Befunden, z. B. proximale Myopathie, breite violette Striae, Hämatomneigung, frühe Osteoporose oder schwer kontrollierbare Komorbidität.",
      "Nebenniereninzidentalom ist ein eigener Kontext: auf autonome Cortisolsekretion prüfen, aber MACS nicht mit manifestem Cushing-Syndrom gleichsetzen."
    ],
    "recommendedTests": [
      "Geeignete Initialtests sind 24-h-Urin auf freies Cortisol, Late-night salivary cortisol, 1-mg-Overnight-DST oder 2-mg/48-h-Low-dose-DST.",
      "Bei auffälligem Ersttest empfiehlt die Leitlinie eine Bestätigung mit einem zweiten geeigneten Test.",
      "Bei Nebenniereninzidentalom ist der 1-mg-DST der zentrale Screeningtest auf milde autonome Cortisolsekretion; Cortisol ≤50 nmol/l (≤1,8 µg/dl) nach DST spricht gegen autonome Cortisolsekretion."
    ],
    "pitfalls": [
      "LNSC ist anfällig für Schichtarbeit, gestörten Schlafrhythmus, falsche Probenzeit und Glukokortikoid-Kontamination.",
      "UFC benötigt korrekte 24-h-Sammlung, Plausibilitätsprüfung mit Volumen/Kreatinin und ist bei eingeschränkter Nierenfunktion oder zyklischem Verlauf begrenzt.",
      "DST kann durch CYP3A4-Induktoren, Östrogene/CBG-Erhöhung, Adhärenzprobleme und unzureichende Dexamethasonexposition falsch auffällig werden."
    ],
    "settingNotes": [
      "In Primärversorgung mit nur unspezifischen metabolischen Merkmalen bleibt die Prätestwahrscheinlichkeit sehr niedrig.",
      "In der Endokrinologie steigt die Prätestwahrscheinlichkeit vor allem durch Zuweisungsselektion, Progression und diskriminative Zeichen.",
      "Für MACS bei Nebenniereninzidentalom berichten Quellen breite Häufigkeitsbereiche; diese betreffen nicht automatisch manifestes Cushing-Syndrom.",
      "Bei Hypophyseninzidentalom empfiehlt die Leitlinie Screening auf Hormonexzess; Glukokortikoidexzess sollte wegen falsch positiver Tests vor allem bei klinischem Verdacht gezielt geprüft werden."
    ],
    "links": [
      {
        "title": "Endocrine Society: Diagnosis of Cushing's Syndrome",
        "year": 2008,
        "url": "https://www.endocrine.org/clinical-practice-guidelines/diagnosis-of-cushing-syndrome",
        "kind": "Leitlinie",
        "note": "Zentrale Leitlinie zur Frage, wen man testen sollte und welche Initialtests geeignet sind."
      },
      {
        "title": "Accuracy of diagnostic tests for Cushing's syndrome: a systematic review and metaanalyses",
        "year": 2008,
        "url": "https://academic.oup.com/jcem/article-abstract/93/5/1553/2598176?redirectedFrom=fulltext",
        "kind": "Review",
        "note": "Systematischer Review zur Testgüte von UFC, LNSC und Dexamethason-Suppressionstests; konkrete Werte bleiben cut-off- und populationsabhängig."
      },
      {
        "title": "Endotext: Endocrine Testing Protocols, HPA Axis",
        "year": 2023,
        "url": "https://www.ncbi.nlm.nih.gov/sites/books/NBK278940/",
        "kind": "Lehrtext",
        "note": "Praktische Protokolle, Präanalytik und Grenzen von Cortisol-, DST-, UFC-, LNSC- und ACTH-Testung."
      },
      {
        "title": "Endotext: Testing for Endocrine Hypertension",
        "year": 2016,
        "url": "https://www.ncbi.nlm.nih.gov/books/NBK278965/",
        "kind": "Lehrtext",
        "note": "Ordnet Cushing-Syndrom als seltene endokrine Hypertonieursache ein und nennt typische klinische Hinweise."
      },
      {
        "title": "ESE/ENSAT Guideline: Adrenal Incidentalomas",
        "year": 2023,
        "url": "https://www.ese-hormones.org/publications/directory/ese-clinical-practice-guideline-on-the-management-of-adrenal-incidentalomas-in-collaboration-with-the-european-network-for-the-study-of-adrenal-tumors/",
        "kind": "Leitlinie",
        "note": "Aktuelle europäische Leitlinie zu Nebenniereninzidentalomen und mild autonomous cortisol secretion."
      },
      {
        "title": "Endocrine Society Clinical Practice Guideline: Pituitary Incidentaloma",
        "year": 2011,
        "url": "https://academic.oup.com/jcem/article/96/4/894/2720833",
        "kind": "Leitlinie",
        "note": "Empfiehlt bei Hypophyseninzidentalomen Evaluation auf Hormonexzess; Cushing-Testung vor allem bei klinischem Verdacht einordnen."
      },
      {
        "title": "Endotext: Adrenal Incidentaloma",
        "year": 2024,
        "url": "https://www.ncbi.nlm.nih.gov/sites/books/NBK279021/?report=reader",
        "kind": "Lehrtext",
        "note": "Einordnung von MACS, 1-mg-DST und weiteren hormonellen Abklärungen beim Nebenniereninzidentalom."
      },
      {
        "title": "AWMF S1: Cushing-Syndrom im Kindesalter",
        "year": 2020,
        "url": "https://register.awmf.org/assets/guidelines/174-010l_S1_Cushing_Syndrom_Hyperkortisolismus_2020-03.pdf",
        "kind": "Leitlinie",
        "note": "Pädiatrische deutsche S1-Leitlinie; nicht als Standardquelle für erwachsene ambulante Endokrinologie verwenden."
      }
    ],
    "lastReviewed": "2026-05-19",
    "reviewStatus": "needs-review",
    "evidenceQuality": "moderate",
    "dataCompleteness": "partial",
    "reviewNote": "Leitlinienbasierte Kurznotiz; quantitative Prävalenzwerte bleiben settingabhängig und sollten separat geprüft werden."
  },
  {
    "conditionId": "primarer-hyperaldosteronismus",
    "summary": "Primärer Hyperaldosteronismus ist eine häufige, oft übersehene und potenziell behandelbare Ursache endokriner Hypertonie. Der diagnostische Einstieg ist das Verhältnis aus Aldosteron und Renin; positive oder unklare Screeningbefunde brauchen je nach Konstellation Bestätigung und später Subtypisierung.",
    "whenToTest": [
      "Screening bei resistenter Hypertonie, kontrollierter Hypertonie mit mindestens vier Medikamenten, persistierend hohem Blutdruck oder Hypertonie mit Hypokaliämie.",
      "Screening bei Hypertonie plus Nebenniereninzidentalom, Schlafapnoe, früher Familienanamnese oder erstgradigen Angehörigen mit PA.",
      "Bei spontaner Hypokaliämie, supprimiertem Renin und deutlich erhöhtem Aldosteron kann eine direkte Subtypisierung ohne klassischen Bestätigungstest erwogen werden."
    ],
    "recommendedTests": [
      "ARR als Screeningtest: Aldosteron, Renin, Kalium, Medikation, Salzstatus, Körperhaltung und Uhrzeit dokumentieren.",
      "Bestätigung je nach Setting mit Kochsalzinfusion, oralem Kochsalzbelastungstest, Fludrocortison-Suppression oder Captopril-Test.",
      "Bestätigungstests nicht als Primärscreening interpretieren; Kontraindikationen wie relevante CKD, Herzinsuffizienz oder schwere Hypokaliämie beachten.",
      "Der 2025er systematische Review stützt die Leitlinienaktualisierung: Evidenz zu Screening-Outcomes bleibt begrenzt, gezielte PA-spezifische Therapie ist aber mit besserer Blutdruckkontrolle assoziiert."
    ],
    "pitfalls": [
      "Hypokaliämie kann Aldosteron senken und falsch negative Ergebnisse begünstigen.",
      "Diuretika, ACE-Hemmer, AT1-Blocker, Betablocker, MR-Antagonisten, ENaC-Inhibitoren und Salzrestriktion können ARR und Bestätigungstests deutlich verschieben.",
      "ARR-Cut-offs sind methoden-, einheiten- und laborabhängig; ein Quotient ohne absolut inadäquat hohes Aldosteron kann irreführend sein."
    ],
    "settingNotes": [
      "In Primärversorgungs-Hypertoniepopulationen berichtet der 2025er Review ungefähr 5-14% PA; in spezialisierten Zuweisungszentren können Werte bis etwa 30% erreicht werden.",
      "Ein älterer Literaturreview fand gewichtete PA-Prävalenzen von etwa 4,3% in Primärversorgung und 9,5% in überwiesenen Kollektiven; die Prävalenz steigt mit Hypertonieschwere.",
      "Resistente Hypertonie und Hypokaliämie sollten eher als eigenes Risikostratum bzw. Setting gewertet werden, um Doppelzählung mit Modifikatoren zu vermeiden.",
      "Endotext nennt häufig verwendete ARR-Cut-offs und Probenhinweise, liefert aber keine universell übertragbare Testgüte für jedes Labor."
    ],
    "links": [
      {
        "title": "Systematic Review Supporting the Endocrine Society Guideline on Primary Aldosteronism",
        "year": 2025,
        "url": "https://academic.oup.com/jcem/article/110/9/e2833/8196230",
        "kind": "Review",
        "note": "Systematischer Review zur 2025er PA-Leitlinie; fasst Prävalenzrahmen, Screening-/Management-Evidenz und PA-spezifische Therapiepfade zusammen."
      },
      {
        "title": "Prevalence of primary aldosteronism in patient's cohorts and in population-based studies",
        "year": 2012,
        "url": "https://pubmed.ncbi.nlm.nih.gov/22135219/",
        "kind": "Review",
        "note": "Literaturreview: gewichtete PA-Prävalenz etwa 4,3% in Primärversorgung und 9,5% in überwiesenen Kollektiven; höhere Werte bei schwererer Hypertonie."
      },
      {
        "title": "Primary aldosteronism: a common cause of resistant hypertension",
        "year": 2017,
        "url": "https://pmc.ncbi.nlm.nih.gov/articles/PMC5461126/",
        "kind": "Review",
        "note": "Review zur hohen klinischen Relevanz und Prävalenz von PA bei resistenter Hypertonie."
      },
      {
        "title": "Prevalence and Clinical Manifestations of Primary Aldosteronism Encountered in Primary Care Practice",
        "year": 2017,
        "url": "https://www.sciencedirect.com/science/article/pii/S0735109717305697",
        "kind": "Studie",
        "note": "Primärversorgungsnahe Hypertoniekohorte mit 5,9% PA insgesamt, 3,9% bei Stadium 1 und 11,8% bei Stadium 3."
      },